{
  "role": "plan",
  "node_path": "planning__plan-loop.plan",
  "rows": [
    {
      "path": "/works-canary-fixture/artifacts/runs/245042a7-d99c-420e-9706-572b5ddca2bc/board/planning/r1/prompt-p2.fix_plan.md",
      "hook": "partial",
      "event": null
    }
  ],
  "sources": {
    "hook": true,
    "events": "unverified"
  },
  "missing": []
}
